21:59:00.842702 IP localhost.35098 > localhost.5005: Flags [S], seq 1642983071, win 65495, options [mss 65495,sackOK,TS val 2866327630 ecr 0,nop,wscale 7], length 0
E..<..@.@.?9............a............0.........
...N........
21:59:00.842710 IP localhost.5005 > localhost.35098: Flags [S.], seq 2414352011, ack 1642983072, win 65483, options [mss 65495,sackOK,TS val 2866327630 ecr 2866327630,nop,wscale 7], length 0
E..<..@.@.<.................a........0.........
...N...N....
21:59:00.842717 IP localhost.35098 > localhost.5005: Flags [.], ack 1, win 512, options [nop,nop,TS val 2866327630 ecr 2866327630], length 0
E..4..@.@.?@............a............(.....
...N...N
21:59:04.382811 IP localhost.35098 > localhost.5005: Flags [P.], seq 1:4, ack 1, win 512, options [nop,nop,TS val 2866331170 ecr 2866327630], length 3
E..7..@.@.?<............a............+.....
..."...Nnew
21:59:04.382823 IP localhost.5005 > localhost.35098: Flags [.], ack 4, win 512, options [nop,nop,TS val 2866331170 ecr 2866331170], length 0
E..4..@.@.P.................a........(.....
..."..."
21:59:04.382890 IP localhost.5005 > localhost.35098: Flags [P.], seq 1:2, ack 4, win 512, options [nop,nop,TS val 2866331170 ecr 2866331170], length 1
E..5..@.@.P.................a........).....
..."..." 
21:59:04.382895 IP localhost.35098 > localhost.5005: Flags [.], ack 2, win 512, options [nop,nop,TS val 2866331170 ecr 2866331170], length 0
E..4..@.@.?>............a............(.....
..."..."
21:59:09.237631 IP localhost.35098 > localhost.5005: Flags [P.], seq 4:13, ack 2, win 512, options [nop,nop,TS val 2866336025 ecr 2866331170], length 9
E..=..@.@.?4............a............1.....
......."guess 500
21:59:09.237725 IP localhost.5005 > localhost.35098: Flags [P.], seq 2:6, ack 13, win 512, options [nop,nop,TS val 2866336025 ecr 2866336025], length 4
E..8..@.@.P.................a........,.....
........MORE
21:59:09.237734 IP localhost.35098 > localhost.5005: Flags [.], ack 6, win 512, options [nop,nop,TS val 2866336025 ecr 2866336025], length 0
E..4..@.@.?<............a............(.....
........
21:59:14.622618 IP localhost.35098 > localhost.5005: Flags [P.], seq 13:22, ack 6, win 512, options [nop,nop,TS val 2866341410 ecr 2866336025], length 9
E..=..@.@.?2............a............1.....
..."....guess 250
21:59:14.622709 IP localhost.5005 > localhost.35098: Flags [P.], seq 6:10, ack 22, win 512, options [nop,nop,TS val 2866341410 ecr 2866341410], length 4
E..8..@.@.P.................a........,.....
..."..."MORE
21:59:14.622718 IP localhost.35098 > localhost.5005: Flags [.], ack 10, win 512, options [nop,nop,TS val 2866341410 ecr 2866341410], length 0
E..4..@.@.?:............a............(.....
..."..."
21:59:19.357626 IP localhost.35098 > localhost.5005: Flags [P.], seq 22:31, ack 10, win 512, options [nop,nop,TS val 2866346145 ecr 2866341410], length 9
E..=..@.@.?0............a............1.....
......."guess 150
21:59:19.357705 IP localhost.5005 > localhost.35098: Flags [P.], seq 10:14, ack 31, win 512, options [nop,nop,TS val 2866346145 ecr 2866346145], length 4
E..8..@.@.P.................a........,.....
........LESS
21:59:19.357713 IP localhost.35098 > localhost.5005: Flags [.], ack 14, win 512, options [nop,nop,TS val 2866346145 ecr 2866346145], length 0
E..4..@.@.?8............a............(.....
........
21:59:28.796700 IP localhost.35098 > localhost.5005: Flags [P.], seq 31:40, ack 14, win 512, options [nop,nop,TS val 2866355584 ecr 2866346145], length 9
E..=..@.@.?.............a............1.....
........guess 200
21:59:28.796773 IP localhost.5005 > localhost.35098: Flags [P.], seq 14:18, ack 40, win 512, options [nop,nop,TS val 2866355584 ecr 2866355584], length 4
E..8..@.@.P.................a........,.....
........MORE
21:59:28.796782 IP localhost.35098 > localhost.5005: Flags [.], ack 18, win 512, options [nop,nop,TS val 2866355584 ecr 2866355584], length 0
E..4..@.@.?6............a............(.....
........
21:59:39.817817 IP localhost.35098 > localhost.5005: Flags [P.], seq 40:49, ack 18, win 512, options [nop,nop,TS val 2866366605 ecr 2866355584], length 9
E..=..@.@.?,............a............1.....
..H.....guess 170
21:59:39.817895 IP localhost.5005 > localhost.35098: Flags [P.], seq 18:22, ack 49, win 512, options [nop,nop,TS val 2866366605 ecr 2866366605], length 4
E..8..@.@.P.................a........,.....
..H...H.LESS
21:59:39.817906 IP localhost.35098 > localhost.5005: Flags [.], ack 22, win 512, options [nop,nop,TS val 2866366605 ecr 2866366605], length 0
E..4..@.@.?4............a............(.....
..H...H.
21:59:46.550875 IP localhost.35098 > localhost.5005: Flags [P.], seq 49:58, ack 22, win 512, options [nop,nop,TS val 2866373338 ecr 2866366605], length 9
E..=..@.@.?*............a............1.....
..b...H.guess 185
21:59:46.550951 IP localhost.5005 > localhost.35098: Flags [P.], seq 22:26, ack 58, win 512, options [nop,nop,TS val 2866373338 ecr 2866373338], length 4
E..8..@.@.P.................a........,.....
..b...b.LESS
21:59:46.550962 IP localhost.35098 > localhost.5005: Flags [.], ack 26, win 512, options [nop,nop,TS val 2866373338 ecr 2866373338], length 0
E..4..@.@.?2............a............(.....
..b...b.
21:59:51.033933 IP localhost.35098 > localhost.5005: Flags [P.], seq 58:67, ack 26, win 512, options [nop,nop,TS val 2866377821 ecr 2866373338], length 9
E..=..@.@.?(............a............1.....
..t]..b.guess 190
21:59:51.034004 IP localhost.5005 > localhost.35098: Flags [P.], seq 26:30, ack 67, win 512, options [nop,nop,TS val 2866377821 ecr 2866377821], length 4
E..8..@.@.P.................a........,.....
..t]..t]MORE
21:59:51.034014 IP localhost.35098 > localhost.5005: Flags [.], ack 30, win 512, options [nop,nop,TS val 2866377821 ecr 2866377821], length 0
E..4..@.@.?0............a............(.....
..t]..t]
21:59:55.147894 IP localhost.35098 > localhost.5005: Flags [P.], seq 67:76, ack 30, win 512, options [nop,nop,TS val 2866381935 ecr 2866377821], length 9
E..=..@.@.?&............a............1.....
...o..t]guess 188
21:59:55.147962 IP localhost.5005 > localhost.35098: Flags [P.], seq 30:35, ack 76, win 512, options [nop,nop,TS val 2866381935 ecr 2866381935], length 5
E..9..@.@.P.................a........-.....
...o...oEQUAL
21:59:55.147971 IP localhost.35098 > localhost.5005: Flags [.], ack 35, win 512, options [nop,nop,TS val 2866381935 ecr 2866381935], length 0
E..4..@.@.?.............a............(.....
...o...o
21:59:59.521943 IP localhost.35098 > localhost.5005: Flags [P.], seq 76:79, ack 35, win 512, options [nop,nop,TS val 2866386309 ecr 2866381935], length 3
E..7..@.@.?*............a............+.....
.......onew
21:59:59.522032 IP localhost.5005 > localhost.35098: Flags [P.], seq 35:60, ack 79, win 512, options [nop,nop,TS val 2866386309 ecr 2866386309], length 25
E..M..@.@.P.................a........A.....
........Last game took 8 attempts
21:59:59.522041 IP localhost.35098 > localhost.5005: Flags [.], ack 60, win 512, options [nop,nop,TS val 2866386309 ecr 2866386309], length 0
E..4..@.@.?,............a............(.....
........
22:00:05.805921 IP localhost.35098 > localhost.5005: Flags [P.], seq 79:83, ack 60, win 512, options [nop,nop,TS val 2866392593 ecr 2866386309], length 4
E..8..@.@.?'............a............,.....
........stop
22:00:05.805988 IP localhost.5005 > localhost.35098: Flags [P.], seq 60:64, ack 83, win 512, options [nop,nop,TS val 2866392593 ecr 2866392593], length 4
E..8..@.@.P.................a........,.....
........EXIT
22:00:05.805996 IP localhost.35098 > localhost.5005: Flags [.], ack 64, win 512, options [nop,nop,TS val 2866392593 ecr 2866392593], length 0
E..4..@.@.?*............a............(.....
........
22:00:05.806020 IP localhost.5005 > localhost.35098: Flags [F.], seq 64, ack 83, win 512, options [nop,nop,TS val 2866392593 ecr 2866392593], length 0
E..4..@.@.P.................a........(.....
........
22:00:05.806108 IP localhost.35098 > localhost.5005: Flags [F.], seq 83, ack 65, win 512, options [nop,nop,TS val 2866392593 ecr 2866392593], length 0
E..4..@.@.?)............a............(.....
........
22:00:05.806120 IP localhost.5005 > localhost.35098: Flags [.], ack 84, win 512, options [nop,nop,TS val 2866392593 ecr 2866392593], length 0
E..4..@.@.P.................a........(.....
........

